{"ok":true,"runId":"a3239d5e-6ad4-4d78-93c5-722e0575372d","instanceId":"ce-priority-dev","skill":"priority-shell-compile","executor":"wcf","startedAt":"2026-10-01T13:07:54.1158287Z","endedAt":"2026-10-01T13:07:55.7805904Z","durationSec":2,"reason":"compiled","exitCode":0,"errors":[],"whatIf":false,"wcfAttempted":true,"revision":"8369","path":"C:\\Priority\\system\\upgrades\\8369.sh","bytes":4749}